<?xml version='1.0' encoding='utf-8' ?>
<!ELEMENT character (id, refresh, current-fate-points, aspects, skills, extras, stunts, consequences?, hacks?, phase-trio, notes?)>

  <!ELEMENT id (charname, playername, description)>
    <!ELEMENT charname (#PCDATA)>
    <!ELEMENT playername (#PCDATA)>
      <!ATTLIST charname nickname CDATA #IMPLIED>
    <!ELEMENT description (#PCDATA)>

    <!ELEMENT refresh (#PCDATA)>
    <!ELEMENT current-fate-points (#PCDATA)>

    <!ELEMENT aspects (aspect*)>
      <!ELEMENT aspect (#PCDATA)>
      <!ATTLIST aspect type (High-Concept|Trouble) #IMPLIED>
      <!ATTLIST aspect phase-num CDATA #IMPLIED>

    <!ELEMENT skills (mode*, skill*)>
      <!ELEMENT mode (skill*)>
      <!ATTLIST mode name   CDATA #REQUIRED>
      <!ATTLIST mode rating CDATA #REQUIRED>
      <!ELEMENT skill (#PCDATA)>
      <!ATTLIST skill name   CDATA #REQUIRED>
      <!ATTLIST skill rating CDATA #IMPLIED>
      <!ATTLIST skill add    CDATA #IMPLIED>

    <!ELEMENT extras (extra*, gadget*)>
      <!ELEMENT extra (#PCDATA)>
        <!ATTLIST extra name CDATA #REQUIRED>
      <!ELEMENT gadget (function, flaws, aspects*, benefits*)>
      <!-- benefits instead of stunts for ease of integration with ARRPG -->
      <!ATTLIST gadget name CDATA #REQUIRED>
      <!ELEMENT function (#PCDATA)>
        <!ELEMENT flaws (flaw*)>
          <!ELEMENT flaw (#PCDATA)>
        <!ELEMENT benefits (benefit*)>
          <!ELEMENT benefit (#PCDATA)>
          <!ATTLIST benefit cost CDATA #IMPLIED>
          <!ATTLIST benefit name CDATA #REQUIRED>

    <!ELEMENT stunts (stunt*)>
      <!ELEMENT stunt (#PCDATA)>
      <!ATTLIST stunt name CDATA #REQUIRED>

    <!ELEMENT consequences (consequence*)>
      <!ELEMENT consequence (#PCDATA)>
        <!ATTLIST consequence effect CDATA #IMPLIED>
        <!ATTLIST consequence severity (Mild|Moderate|Severe|Mild-Physical|Mild-Mental) #REQUIRED>

    <!ELEMENT hacks (#PCDATA)>
      <!ATTLIST hacks conditions  (true|false) "false"> <!-- Fate System Toolkit     -->
      <!ATTLIST hacks corruption  (true|false) "false"> <!-- Fate Freeport Companion -->
      <!ATTLIST hacks skill-modes (true|false) "false"> <!-- Fate System Toolkit     -->

    <!ELEMENT phase-trio (phase*)>
      <!ELEMENT phase (events*)>
        <!ATTLIST phase num   CDATA #REQUIRED>
        <!ATTLIST phase title CDATA #IMPLIED>
        <!ELEMENT events (#PCDATA)>

    <!ELEMENT notes (#PCDATA)>
